RIC,Symbol,Exchange,CompanyName,Sector,Industry,Last
MAC.HN,MAC,HNX,Marine Supply and Engineering Service JSC,Industrials,Transportation Infrastructure,5900
MAS.HN,MAS,HNX,Danang Airport Services JSC,Industrials,Transportation Infrastructure,36600
MBB.HM,MBB,HOSE,Military Commercial Joint Stock Bank,Financial,Banks,42100
MBG.HN,MBG,HNX,MBG Group JSC,Industrials,Construction & Engineering,7300
MBS.HN,MBS,HNX,MB Securities JSC,Financial,Capital Markets,30900
MCC.HN,MCC,HNX,High Grade Brick Tile Corp,Materials,Construction Materials,13700
MCF.HN,MCF,HNX,Mechanics Construction and Foodstuff JSC,Consumer Staples,Food Products,9300
MCG.HM,MCG,HOSE,Viet Nam Mechanization Electrification and Construction JSC,Industrials,Construction & Engineering,3130
MCH.HNO,MCH,UPCOM,Masan Consumer Corp,Consumer Staples,Food Products,113100
MCO.HN,MCO,HNX,BDC Viet Nam Construction and Investment JSC,Industrials,Construction & Engineering,3600
MCP.HM,MCP,HOSE,Mychau Printing and Packaging Corp,Materials,Containers & Packaging,23800
MDC.HN,MDC,HNX,Vinacomin Mong Duong Coal JSC,Energy,"Oil, Gas & Consumable Fuels",8500
MDF.HNO,MDF,UPCOM,MDF VRG Quang Tri Wood JSC,Materials,Paper & Forest Products,12700
MDG.HM,MDG,HOSE,Mien Dong JSC,Industrials,Construction & Engineering,11700
MEC.HNO,MEC,UPCOM,Song Da Mechanical Assembling JSC,Industrials,Construction & Engineering,500
MED.HN,MED,HNX,Mediplantex National Pharmaceutical JSC,Healthcare,Pharmaceuticals,38000
MEF.HNO,MEF,UPCOM,Meinfa JSC,Healthcare,Health Care Equipment & Supplies,1600
MEL.HN,MEL,HNX,Me Lin Steel JSC,Materials,Metals & Mining,15000
MGC.HNO,MGC,UPCOM,Vinacomin Mining Geology JSC,Energy,"Oil, Gas & Consumable Fuels",6300
MGG.HNO,MGG,UPCOM,Duc Giang Corp,Consumer Discretionary,"Textiles, Apparel & Luxury Goods",39900
MH3.HNO,MH3,UPCOM,Binh Long Rubber Industrial Park Corp,Capital Goods,Construction Services,59000
MHC.HM,MHC,HOSE,MHC JSC,Industrials,Marine,13500
MHL.HN,MHL,HNX,Minh Huu Lien JSC,Materials,Metals & Mining,5600
MIC.HNO,MIC,UPCOM,Quang Nam Mineral Industry Corp,Materials,Metals & Mining,7000
MIG.HM,MIG,HOSE,Military Insurance Corp,Financial,Insurance (Prop. & Casualty),20300
MIM.HN,MIM,HNX,Mineral and Mechanical JSC,Materials,Metals & Mining,6900
MKP.HNO,MKP,UPCOM,Mekophar Chemical Pharmaceutical JSC,Healthcare,Pharmaceuticals,39800
MKV.HN,MKV,HNX,Cai Lay Veterinary Pharmaceutical JSC,Healthcare,Major Drugs,33000
MLS.HNO,MLS,UPCOM,Mitraco Livestock JSC,Consumer Staples,Food Products,40900
MND.HNO,MND,UPCOM,Nam Dinh Environment JSC,,,10000
MPC.HNO,MPC,UPCOM,Minh Phu Seafood JSC,Consumer Staples,Food Products,39000
MPT.HNO,MPT,UPCOM,Truong Tien Group JSC,Consumer Discretionary,"Textiles, Apparel & Luxury Goods",2300
MQN.HNO,MQN,UPCOM,Quang Ngai Urban Environment JSC,Industrials,Commercial Services & Supplies,36700
MRF.HNO,MRF,UPCOM,Merufa JSC,Consumer Staples,Personal Products,52000
MSB.HM,MSB,HOSE,Vietnam Maritime Commercial Joint Stock Bank,Financial,Banks,28350
MSH.HM,MSH,HOSE,Song Hong Garment JSC,Consumer Discretionary,"Textiles, Apparel & Luxury Goods",64000
MSN.HM,MSN,HOSE,Masan Group Corp,Consumer/Non-Cyclical,Food Processing,106400
MSR.HNO,MSR,UPCOM,Masan High-Tech Materials Corp,Basic Materials,Metal Mining,20900
MST.HN,MST,HNX,MST Investment JSC,Industrials,Construction & Engineering,14100
MTA.HNO,MTA,UPCOM,Hatinh Minerals and Trading Joint Stock Corp,Materials,Metals & Mining,7100
MTG.HNO,MTG,UPCOM,MT Gas JSC,Energy,"Oil, Gas & Consumable Fuels",4300
MTH.HNO,MTH,UPCOM,Ha Dong Environment Public Service JSC,Industrials,Commercial Services & Supplies,28700
MTL.HNO,MTL,UPCOM,Tu Liem Urban Environment Service JSC,,,5900
MTP.HNO,MTP,UPCOM,Medipharco Pharmaceutical JSC,Healthcare,Pharmaceuticals,11900
MTV.HNO,MTV,UPCOM,Vung Tau Environment Services and Urban Project JSC,Industrials,Commercial Services & Supplies,16600
MVB.HN,MVB,HNX,Vinacomin Viet Bac Mining Industry Holding Corp,Energy,"Oil, Gas & Consumable Fuels",18700
MVC.HNO,MVC,UPCOM,Binh Duong Building Materials and Construction Corp,Materials,Construction Materials,8800
MVY.HNO,MVY,UPCOM,Vinhyen Environment and Urban Services JSC,Industrials,Commercial Services & Supplies,23200
MWG.HM,MWG,HOSE,Mobile World Investment Corp,Services,Retail (Technology),143700
NAC.HNO,NAC,UPCOM,National of General Construction Consultants JSC,,,2900
NAF.HM,NAF,HOSE,Nafoods Group JSC,Consumer Staples,Food Products,29600
NAG.HN,NAG,HNX,Nagakawa Group JSC,Consumer Discretionary,Household Durables,7500
NAP.HN,NAP,HNX,Nghe Tinh Port JSC,Industrials,Transportation Infrastructure,11000
NAS.HNO,NAS,UPCOM,Noi Bai Airport Services JSC,Industrials,Transportation Infrastructure,32000
NAV.HM,NAV,HOSE,Namviet JSC,Materials,Construction Materials,18000
NAW.HNO,NAW,UPCOM,Nghe An Water Supply JSC,Utilities,Water Utilities,8100
NBB.HM,NBB,HOSE,577 Investment Corp,Real Estate,Real Estate Management & Development,29000
NBC.HN,NBC,HNX,Vinacomin NuiBeo Coal JSC,Energy,"Oil, Gas & Consumable Fuels",12700
NBE.HNO,NBE,UPCOM,North Books and Educational Equipment JSC,,,9900
NBP.HN,NBP,HNX,NinhBinh Thermal Power JSC,Utilities,Electric Utilities,13900
NBR.HNO,NBR,UPCOM,Nghiabinh Rail Way JSC,,,11000
NBW.HN,NBW,HNX,Nha Be Water Supply JSC,Utilities,Water Utilities,42900
NCP.HNO,NCP,UPCOM,TKV - Campha Thermal Power JSC,Utilities,Independent Power and Renewable Electricity Producers,6700
NCS.HNO,NCS,UPCOM,Noi Bai Catering Services JSC,Industrials,Commercial Services & Supplies,19800
NCT.HM,NCT,HOSE,Noibai Cargo Terminal Services JSC,Industrials,Transportation Infrastructure,71000
ND2.HNO,ND2,UPCOM,North Electrictiy Development and Investment JSC No2,Utilities,Independent Power and Renewable Electricity Producers,28100
NDC.HNO,NDC,UPCOM,Nam Duoc JSC,Healthcare,Pharmaceuticals,105000
NDF.HNO,NDF,UPCOM,Nam Dinh Export Foodstuff and Agricultural Products Processing JSC,Consumer Staples,Food Products,1400
NDN.HN,NDN,HNX,Danang Housing Investment Development JSC,Industrials,Construction & Engineering,23000
NDP.HNO,NDP,UPCOM,National Day Pharmaceutical JSC,Healthcare,Pharmaceuticals,24400
NDX.HN,NDX,HNX,Danang Housing Development JSC,Industrials,Construction & Engineering,8300
NED.HNO,NED,UPCOM,North-West Electric Investment and Development JSC,Utilities,Independent Power and Renewable Electricity Producers,11800
NET.HN,NET,HNX,NET Detergent JSC,Consumer Staples,Household Products,66000
NFC.HN,NFC,HNX,Ninh Binh Phosphate Fertilizer JSC,Materials,Chemicals,9500
NGC.HNO,NGC,UPCOM,Ngo Quyen Processing Export JSC,Consumer Staples,Food Products,7400
NHA.HM,NHA,HOSE,Ha Noi South Housing and Urban Development Corp,Industrials,Construction & Engineering,28500
NHC.HN,NHC,HNX,Nhi Hiep Brick Tile Co-Operation,Materials,Construction Materials,34700
NHH.HM,NHH,HOSE,Hanoi Plastics JSC,Basic Materials,Containers & Packaging,57300
NHP.HN,NHP,HNX,NHP Production Import Export JSC,Materials,Chemicals,700
NHT.HNO,NHT,UPCOM,Nam Hoa Trading & Production Corp,Consumer Discretionary,Household Durables,35500
NHV.HNO,NHV,UPCOM,NHV Investment JSC,Industrials,Electrical Equipment,20000
NKG.HM,NKG,HOSE,Nam Kim Steel JSC,Materials,Metals & Mining,33200
NLG.HM,NLG,HOSE,Nam Long Investment Corp,Real Estate,Real Estate Management & Development,38500
NLS.HNO,NLS,UPCOM,Lang Son Water Supply and Drainage JSC,Utilities,Water Utilities,6800
NMK.HNO,NMK,UPCOM,Civil Engineering Construction JSC No.510,Industrials,Construction & Engineering,8500
NNC.HM,NNC,HOSE,Nui Nho Stone JSC,Materials,Construction Materials,26600
NNG.HNO,NNG,UPCOM,Ngoc Nghia Industry Service Trading JSC,Materials,Containers & Packaging,11500
NNT.HNO,NNT,UPCOM,Ninh Thuan Water Supply JSC,Utilities,Water Utilities,30000
NOS.HNO,NOS,UPCOM,Oriental Shipping and Trading JSC,Industrials,Marine,1100
NQN.HNO,NQN,UPCOM,Quangninh Clean Water JSC,Utilities,Water Utilities,13800
NQT.HNO,NQT,UPCOM,Quang Tri Clean Water JSC,,,8650
NRC.HN,NRC,HNX,Danh Khoi Group JSC,Real Estate,Real Estate Management & Development,20200
NS2.HNO,NS2,UPCOM,Hanoi Water Supply Number 2 JSC,Utilities,Water Utilities,8600
NS3.HNO,NS3,UPCOM,Ha Noi Water Manufacturing JSC No 3,Industrials,Commercial Services & Supplies,16500
NSC.HN,NSC,HNX,Vietnam National Seed Group JSC,Consumer Staples,Food Products,83000
NSG.HNO,NSG,UPCOM,Sai Gon Plastic JSC,,,8800
NSH.HN,NSH,HNX,Song Hong Aluminum JSC,Materials,Metals & Mining,8100
NST.HN,NST,HNX,Ngan Son JSC,Consumer Staples,Tobacco,7900
NT2.HM,NT2,HOSE,PetroVietnam Power Nhon Trach 2 JSC,Utilities,Electric Utilities,20700
NTB.HNO,NTB,UPCOM,Transport Engineering Construction and Business Investment JSC 584,Real Estate,Real Estate Management & Development,700
NTC.HNO,NTC,UPCOM,Nam Tan Uyen Joint Stock Corp,Real Estate,Real Estate Management & Development,213900
NTH.HN,NTH,HNX,Nuoc Trong Hydro Power JSC,Utilities,Independent Power and Renewable Electricity Producers,31000
NTL.HM,NTL,HOSE,Tu Liem Urban Development JSC,Real Estate,Real Estate Management & Development,26800
NTP.HN,NTP,HNX,Tien Phong Plastic JSC,Industrials,Building Products,52500
NTW.HNO,NTW,UPCOM,Nhon Trach Water Supply JSC,Utilities,Water Utilities,20400
NUE.HNO,NUE,UPCOM,Nha Trang Urban Environmental JSC,Industrials,Commercial Services & Supplies,8800
NVB.HN,NVB,HNX,National Citizen Commercial Joint Stock Bank,Financial,Banks,19000
NVL.HM,NVL,HOSE,No Va Land Investment Group Corp,Real Estate,Real Estate Management & Development,120000
NVT.HM,NVT,HOSE,Ninh Van Bay Travel Real Estate JSC,Real Estate,Real Estate Management & Development,9520
OCB.HM,OCB,HOSE,Orient Commercial Joint Stock Bank,Financial,Banks,30100
OCH.HN,OCH,HNX,OCH Hospitality & Service JSC,Consumer Discretionary,"Hotels, Restaurants & Leisure",8700
OGC.HM,OGC,HOSE,Ocean Group JSC,Financial,Diversified Financial Services,6230
OIL.HNO,OIL,UPCOM,Petrovietnam Oil Corp,Energy,"Oil, Gas & Consumable Fuels",15400
ONE.HN,ONE,HNX,One Communication Technology Corp,Information Technology,IT Services,6400
ONW.HNO,ONW,UPCOM,One World Services JSC,,,7500
OPC.HM,OPC,HOSE,OPC Pharmaceutical JSC,Healthcare,Pharmaceuticals,57400
ORS.HNO,ORS,UPCOM,Tien Phong Securities Corporation,Financial,Capital Markets,6300
PAC.HM,PAC,HOSE,Dry Cell and Storage Battery JSC,Consumer Discretionary,Auto Components,37000
PAN.HN,PAN,HNX,PAN Group JSC,Consumer Staples,Food Products,27900
PBP.HN,PBP,HNX,Petrovietnam Packaging JSC,Materials,Containers & Packaging,10100
PC1.HM,PC1,HOSE,Power Construction JSC No 1,Industrials,Construction & Engineering,26600
PCC.HNO,PCC,UPCOM,Petrolimex Construction 1 JSC Group,Capital Goods,Construction Services,13500
PCE.HN,PCE,HNX,Central Petrovietnam Fertilizer and Chemicals JSC,Materials,Chemicals,13500
PCF.HNO,PCF,UPCOM,Petec Coffee JSC,,,6400
PCG.HN,PCG,HNX,Petrovietnam Gas City Investment and Development JSC,Energy,"Oil, Gas & Consumable Fuels",10500
PCN.HNO,PCN,UPCOM,DMC Northern Petrolium Chemicals JSC,Industrials,Trading Companies & Distributors,4500
PCT.HN,PCT,HNX,Viet Nam Gas and Chemicals Transportation Corp,Energy,"Oil, Gas & Consumable Fuels",6600
PDB.HN,PDB,HNX,Din Capital Investment Group JSC,Materials,Construction Materials,10000
PDC.HN,PDC,HNX,Phuong Dong Petroleum Tourism JSC,Consumer Discretionary,"Hotels, Restaurants & Leisure",5000
PDN.HM,PDN,HOSE,Dong Nai Port JSC,Industrials,Transportation Infrastructure,88000
PDR.HM,PDR,HOSE,Phat Dat Real Estate Development Corp,Real Estate,Real Estate Management & Development,95000
PDV.HNO,PDV,UPCOM,Phuong Dong Viet Transportation Oil JSC,Industrials,Air Freight & Logistics,6400
PEC.HNO,PEC,UPCOM,Power Engineering JSC,Industrials,Professional Services,5100
PEN.HN,PEN,HNX,Petrolimex Installation No III JSC,Energy,Energy Equipment & Services,8000
PEQ.HNO,PEQ,UPCOM,Petrolimex Equipment JSC,,,41000
PET.HM,PET,HOSE,PetroVietnam General Services Corp,Industrials,Industrial Conglomerates,21400
PFL.HNO,PFL,UPCOM,Petroleum Dong Do JSC,Real Estate,Real Estate Management & Development,3700
PGC.HM,PGC,HOSE,Petrolimex Gas Corp JSC,Energy,"Oil, Gas & Consumable Fuels",17250
PGD.HM,PGD,HOSE,Petrovietnam Low Pressure Gas Distribution JSC,Utilities,Gas Utilities,29500
PGI.HM,PGI,HOSE,Petrolimex Insurance Corp,Financial,Insurance,20550
PGN.HN,PGN,HNX,Plastic Additives JSC,Materials,Chemicals,15100
PGS.HN,PGS,HNX,Southern Gas Trading JSC,Energy,"Oil, Gas & Consumable Fuels",18700
PGT.HN,PGT,HNX,PGT Holdings JSC,Energy,"Oil, Gas & Consumable Fuels",4400
PGV.HNO,PGV,UPCOM,Power Generation Joint Stock Corporation 3,Utilities,Electric Utilities,17700
PHC.HM,PHC,HOSE,Phuc Hung Holdings Construction JSC,Industrials,Construction & Engineering,17800
PHH.HNO,PHH,UPCOM,Hongha Vietnam JSC,Industrials,Construction & Engineering,12000
PHN.HN,PHN,HNX,Hanoi Battery JSC,Industrials,Electrical Equipment,32500
PHP.HN,PHP,HNX,Port of Hai Phong JSC,Industrials,Transportation Infrastructure,23900
PHR.HM,PHR,HOSE,Phuoc Hoa Rubber JSC,Materials,Chemicals,57000
PIA.HN,PIA,HNX,Petrolimex Information Technology and Telecommunication JSC,Information Technology,Software,31500
PIC.HN,PIC,HNX,PC3 Investment JSC,Industrials,Construction & Engineering,10300
PID.HNO,PID,UPCOM,Petroleum Interior Decoration JSC,Consumer Discretionary,Household Durables,1800
PIT.HM,PIT,HOSE,Petrolimex International Trading JSC,Industrials,Trading Companies & Distributors,5950
PIV.HNO,PIV,UPCOM,PIV JSC,Services,Real Estate Operations,1500
PJC.HN,PJC,HNX,Petrolimex Ha Noi Transportation and Trading JSC,Energy,"Oil, Gas & Consumable Fuels",19800
PJS.HNO,PJS,UPCOM,Phu Hoa Tan Water Supply JSC,Utilities,Water Utilities,13500
PJT.HM,PJT,HOSE,Petrolimex Joint Stock Tanker Co,Energy,"Oil, Gas & Consumable Fuels",12500
PKR.HNO,PKR,UPCOM,Phu Khanh Railway JSC,,,7100
PLA.HNO,PLA,UPCOM,Petroleum Logistic Service and Investment JSC,,,6400
PLC.HN,PLC,HNX,Petrolimex Petrochemical Corp JSC,Materials,Chemicals,27200
PLP.HM,PLP,HOSE,Pha Le Plastics Manufacturing and Technology JSC,Materials,Chemicals,10000
PLX.HM,PLX,HOSE,Vietnam National Petroleum Group,Energy,"Oil, Gas & Consumable Fuels",56500
PMB.HN,PMB,HNX,North PetroVietnam Fertilizer & Chemicals JSC,Materials,Chemicals,9800
PMC.HN,PMC,HNX,Pharmedic Pharmaceutical Medicinal JSC,Healthcare,Pharmaceuticals,67200
PME.HM,PME,HOSE,Pymepharco JSC,Healthcare,Pharmaceuticals,84000
PMG.HM,PMG,HOSE,Petro Center Corp,Utilities,Gas Utilities,19000
PMJ.HNO,PMJ,UPCOM,Posts and Telecommunications Material Supply JSC,Industrials,Trading Companies & Distributors,22000
PMP.HN,PMP,HNX,Dam Phu My Packaging JSC,Materials,Containers & Packaging,11500
PMS.HN,PMS,HNX,Petroleum Mechanical JSC,Industrials,Industrial Conglomerates,18300
PMT.HNO,PMT,UPCOM,Telvina Vietnam Communication JSC,Information Technology,"Electronic Equipment, Instruments & Components",7000
PNC.HM,PNC,HOSE,Phuong Nam Cultural Joint Stock Corp,Industrials,Industrial Conglomerates,9500
PND.HNO,PND,UPCOM,Petrovietnam Oil Nam Dinh JSC,,,16300
PNG.HNO,PNG,UPCOM,Phu Nhuan Trading JSC,Industrials,Industrial Conglomerates,13800
PNJ.HM,PNJ,HOSE,Phu Nhuan Jewelry JSC,Consumer Discretionary,"Textiles, Apparel & Luxury Goods",97400
PNT.HNO,PNT,UPCOM,Phu Nhuan Technical Construction JSC,,,7200
POB.HNO,POB,UPCOM,Petrovietnam Oil Thai Binh JSC,,,15100
POM.HM,POM,HOSE,Pomina Steel Corp,Materials,Metals & Mining,16100
POS.HNO,POS,UPCOM,PTSC Offshore Services JSC,Energy,Energy Equipment & Services,14900
POT.HN,POT,HNX,Post and Telecommunication Equipment JSC,Information Technology,Communications Equipment,14400
POV.HNO,POV,UPCOM,Vung Ang Petroleum JSC,Energy,"Oil, Gas & Consumable Fuels",8500
POW.HM,POW,HOSE,Petrovietnam Power Corp,Utilities,Electric Utilities,12150
PPC.HM,PPC,HOSE,Pha Lai Thermal Power JSC,Utilities,Electric Utilities,25100
PPE.HN,PPE,HNX,PetroVietnam Power Engineering Consulting JSC,Industrials,Construction & Engineering,13400
PPH.HNO,PPH,UPCOM,Phong Phu Corp,Consumer Discretionary,"Textiles, Apparel & Luxury Goods",25400
PPP.HN,PPP,HNX,Phong Phu Pharmaceutical JSC,Healthcare,Pharmaceuticals,11800
PPS.HN,PPS,HNX,PertroVietnam Power Services JSC,Industrials,Construction & Engineering,9800
PPY.HN,PPY,HNX,PetroVietnam Oil Phu Yen JSC,Energy,"Oil, Gas & Consumable Fuels",11600
PRC.HN,PRC,HNX,Portserco Logistics JSC,Industrials,Road & Rail,12500
PRE.HN,PRE,HNX,PVI Reinsurance Joint-Stock Corp,Financial,Insurance,17800
PRO.HNO,PRO,UPCOM,Procimex Vietnam JSC,Consumer Staples,Food Products,4200
PRT.HNO,PRT,UPCOM,Binh Duong Producing and Trading Corp,Materials,Chemicals,15600
PSB.HNO,PSB,UPCOM,Sao Mai Ben Dinh Petroleum Investment JSC,Energy,Energy Equipment & Services,6900
PSC.HN,PSC,HNX,Petrolimex Saigon Transportation and Service JSC,Energy,"Oil, Gas & Consumable Fuels",14000
PSD.HN,PSD,HNX,Petroleum General Distribution Services JSC,Information Technology,"Electronic Equipment, Instruments & Components",16800
PSE.HN,PSE,HNX,South East PetroVietnam Fertilizer and Chemicals JSC,Materials,Chemicals,10200
PSG.HNO,PSG,UPCOM,Sai Gon Petroleum Construction and Investment JSC,Industrials,Construction & Engineering,900
PSH.HM,PSH,HOSE,Nam Song Hau Trading Investing Petroleum JSC,Energy,"Oil, Gas & Consumable Fuels",26600
PSI.HN,PSI,HNX,Petrovienam Securities Inc,Financial,Capital Markets,10100
PSL.HNO,PSL,UPCOM,Phu Son Livestock JSC,Consumer Staples,Food Products,26200
PSN.HNO,PSN,UPCOM,PTSC Thanh Hoa Port JSC,Energy,Energy Equipment & Services,9500
PSP.HNO,PSP,UPCOM,Dinh Vu Petroleum Services Port JSC,Industrials,Transportation Infrastructure,8100
PSW.HN,PSW,HNX,South West PetroVietnam Fertilizer and Chemicals JSC,Industrials,Trading Companies & Distributors,9000
PTB.HM,PTB,HOSE,Phu Tai JSC,Materials,Construction Materials,86000
PTC.HM,PTC,HOSE,Post and Telecommunications Investment and Construction JSC,Industrials,Construction & Engineering,12000
PTD.HN,PTD,HNX,Phuc Thinh Design Construction Trading Corp,Industrials,Construction & Engineering,18000
PTE.HNO,PTE,UPCOM,Phu Tho Cement JSC,Materials,Construction Materials,2300
PTG.HNO,PTG,UPCOM,Phan Thiet Garment Import Export JSC,Consumer Discretionary,"Textiles, Apparel & Luxury Goods",100
PTH.HNO,PTH,UPCOM,Petrolimex Hatay Transportation and Service JSC,Energy,"Oil, Gas & Consumable Fuels",8600
PTI.HN,PTI,HNX,Post & Telecommunication Joint Stock Insurance Corp,Financial,Insurance,31400
PTL.HM,PTL,HOSE,Petro Capital and Infrastructure Investment JSC,Real Estate,Real Estate Management & Development,5390
PTO.HNO,PTO,UPCOM,Post and Telecommunication Services Construction Work JSC,Industrials,Construction & Engineering,2300
PTP.HNO,PTP,UPCOM,Post Printing And Telecommunication Services JSC,Communication Services,Media,15500
PTS.HN,PTS,HNX,Petrolimex Haiphong Transportation and Services Join Stock Co,Energy,"Oil, Gas & Consumable Fuels",8700
PTT.HNO,PTT,UPCOM,Indochina Petroleum Transportation JSC,Energy,"Oil, Gas & Consumable Fuels",4800
PV2.HN,PV2,HNX,PV2 Investment JSC,Real Estate,Real Estate Management & Development,3500
PVA.HNO,PVA,UPCOM,Petrovietnam-Nghe An Construction Joint Stock Corp,Industrials,Construction & Engineering,900
PVB.HN,PVB,HNX,Petrovietnam Coating JSC,Energy,Energy Equipment & Services,16700
PVC.HN,PVC,HNX,Petrovietnam Chemical and Services Corp,Energy,Energy Equipment & Services,12000
PVD.HM,PVD,HOSE,PetroVietnam Drilling & Well Service Corp,Energy,Energy Equipment & Services,23000
PVE.HNO,PVE,UPCOM,Petrovietnam Engineering Consultancy JSC,Energy,Energy Equipment & Services,2600
PVG.HN,PVG,HNX,Petro Vietnam LPG JSC,Energy,"Oil, Gas & Consumable Fuels",9500
PVH.HNO,PVH,UPCOM,Thanh Hoa Petroleum Construction JSC,,,1200
PVI.HN,PVI,HNX,PVI Holdings,Financial,Insurance,41500
PVL.HN,PVL,HNX,Viet Property Investment JSC,Real Estate,Real Estate Management & Development,3800
PVM.HNO,PVM,UPCOM,Petrovietnam Machinery Technology JSC,Industrials,Trading Companies & Distributors,23000
PVO.HNO,PVO,UPCOM,PV Oil Lube JSC,Energy,"Oil, Gas & Consumable Fuels",7900
PVP.HNO,PVP,UPCOM,Pacific Petroleum Transportation JSC,Energy,Oil Well Services & Equipment,16600
PVR.HNO,PVR,UPCOM,Ha Noi PVR Investment JSC,Real Estate,Real Estate Management & Development,1900
PVS.HN,PVS,HNX,Petrovietnam Technical Services Corp,Energy,Energy Equipment & Services,30300
PVT.HM,PVT,HOSE,Petrovietnam Transportation Corp,Energy,Energy Equipment & Services,21250
PVX.HNO,PVX,UPCOM,PetroVietnam Construction Joint Stock Corp,Industrials,Construction & Engineering,1000
PXA.HNO,PXA,UPCOM,PetroVietnam Nghe An Investment & Trading JSC,Industrials,Construction & Engineering,2000
PXI.HM,PXI,HOSE,Petroleum Industrial And Civil Construction JSC,Industrials,Construction & Engineering,3450
PXL.HNO,PXL,UPCOM,Long Son Petroleum Industrial Zone Investment JSC,Industrials,Construction & Engineering,9800
PXM.HNO,PXM,UPCOM,Mien Trung Petroleum Construction JSC,Industrials,Construction & Engineering,600
PXS.HM,PXS,HOSE,Petroleum Equipment Assembly and Metal Structure JSC,Energy,Energy Equipment & Services,6860
PXT.HNO,PXT,UPCOM,Petroleum Pipeline & Tank Construction JSC,Energy,Energy Equipment & Services,2200
QBS.HN,QBS,HNX,Quang Binh Import and Export JSC,Consumer/Non-Cyclical,Personal & Household Prods.,3100
QCC.HNO,QCC,UPCOM,Construction Investment And Telecommunications Infrastructure Development JSC,Industrials,Construction & Engineering,9200
QCG.HM,QCG,HOSE,Quoc Cuong GiaLai JSC,Real Estate,Real Estate Management & Development,7520
QHD.HN,QHD,HNX,Viet Duc Welding Electrode JSC,Industrials,Electrical Equipment,36600
QHW.HNO,QHW,UPCOM,Quang Ninh Mineral Water Corp,Consumer/Non-Cyclical,Food Processing,17500
QLT.HNO,QLT,UPCOM,Inland Waterway Management Maintenance No10 JSC,Industrials,Transportation Infrastructure,16700
QNC.HNO,QNC,UPCOM,Quang Ninh Construction and Cement JSC,Materials,Construction Materials,5300
QNS.HNO,QNS,UPCOM,Quang Ngai Sugar JSC,Consumer Staples,Food Products,40400
QPH.HNO,QPH,UPCOM,Que Phong Hydropower JSC,Industrials,Construction & Engineering,24000
QSP.HNO,QSP,UPCOM,Quy Nhon New Port JSC,Transportation,Misc. Transportation,19900
QST.HN,QST,HNX,Quang Ninh Book and Educational Equipment JSC,Consumer Discretionary,Distributors,13500
QTC.HN,QTC,HNX,Quang Nam Construction Transportation JSC,Industrials,Construction & Engineering,14800
QTP.HNO,QTP,UPCOM,Quang Ninh Thermal Power JSC,Utilities,Independent Power and Renewable Electricity Producers,14200
RAL.HM,RAL,HOSE,Rang Dong Light Source and Vacuum Flask JSC,Industrials,Electrical Equipment,195900
RAT.HNO,RAT,UPCOM,Railway Transport And Trade JSC,Industrials,Road & Rail,10300
RBC.HNO,RBC,UPCOM,Rubber Industry and Import Export JSC,,,14600
RCC.HNO,RCC,UPCOM,Railway Construction Corporation JSC,Industrials,Industrial Conglomerates,26400
RCD.HNO,RCD,UPCOM,Rubber Real Estate Construction JSC,Industrials,Construction & Engineering,5100
RCL.HN,RCL,HNX,Cho Lon Real Estate JSC,Real Estate,Real Estate Management & Development,16200
RDP.HM,RDP,HOSE,Rang Dong Holding JSC,Materials,Chemicals,9700
REE.HM,REE,HOSE,Refrigeration Electrical Engineering Corp,Industrials,Industrial Conglomerates,56500
RGC.HNO,RGC,UPCOM,PV - Inconess Investment Corp,Consumer Discretionary,"Hotels, Restaurants & Leisure",14000
RHN.HNO,RHN,UPCOM,Haninh Railway JSC,,,10000
RIC.HM,RIC,HOSE,Royal International JSC,Consumer Discretionary,"Hotels, Restaurants & Leisure",18750
ROS.HM,ROS,HOSE,FLC Faros Construction JSC,Capital Goods,Construction Services,6700
RTB.HNO,RTB,UPCOM,Tan Bien Rubber JSC,Materials,Chemicals,15000
RTH.HNO,RTH,UPCOM,Thanh Hoa Railway JSC,,,9000
S12.HNO,S12,UPCOM,Song Da No12 JSC,Industrials,Construction & Engineering,700
S27.HNO,S27,UPCOM,Song Da 27 JSC,Industrials,Construction & Engineering,1700
S4A.HM,S4A,HOSE,Sesan 4A Hydroelectric JSC,Utilities,Independent Power and Renewable Electricity Producers,26500
S55.HN,S55,HNX,Song Da 505 JSC,Industrials,Construction & Engineering,34000
S72.HNO,S72,UPCOM,Song Da 702 Hydroelectric JSC,,,6200
S74.HNO,S74,UPCOM,Song Da 7.04 JSC,Industrials,Construction & Engineering,5200
S96.HNO,S96,UPCOM,Song Da No 9.06 JSC,Industrials,Construction & Engineering,800
S99.HN,S99,HNX,SCI JSC,Industrials,Construction & Engineering,21100
SAB.HM,SAB,HOSE,Saigon Beer Alcohol Beverage Corp,Consumer Staples,Beverages,171900
SAC.HNO,SAC,UPCOM,Sai Gon Port Stevedoring And Service JSC,,,11000
SAF.HN,SAF,HNX,Safoco Foodstuff JSC,Consumer Staples,Food Products,51100
SAL.HNO,SAL,UPCOM,Viet Nam Salvage JSC,,,8609
SAM.HM,SAM,HOSE,Sam Holdings Corp,Industrials,Electrical Equipment,10350
SAP.HNO,SAP,UPCOM,Textbook Printing JSC in Ho Chi Minh City,Industrials,Commercial Services & Supplies,9000
SAS.HNO,SAS,UPCOM,Southern Airports Services JSC,Industrials,Transportation Infrastructure,26300
SAV.HM,SAV,HOSE,Savimex Corp,Consumer Discretionary,Household Durables,27900
SB1.HNO,SB1,UPCOM,Saigon- Nghetinh Beer JSC,Consumer Staples,Beverages,9100
SBA.HM,SBA,HOSE,Song Ba JSC,Utilities,Independent Power and Renewable Electricity Producers,16000
SBD.HNO,SBD,UPCOM,SaoBacDau Technologies Corp,Information Technology,IT Services,10000
SBL.HNO,SBL,UPCOM,Saigon-Baclieu Beer JSC,Consumer/Non-Cyclical,Beverages (Alcoholic),10600
SBM.HNO,SBM,UPCOM,Bac Minh Development Investment JSC,Utilities,Electric Utilities,28500
SBS.HNO,SBS,UPCOM,Sacombank Securities JSC,Financial,Capital Markets,14100
SBT.HM,SBT,HOSE,Thanh Thanh Cong - Bien Hoa JSC,Consumer Staples,Food Products,20900
SBV.HM,SBV,HOSE,Siam Brothers Vietnam JSC,Consumer Discretionary,"Textiles, Apparel & Luxury Goods",14500
SC5.HM,SC5,HOSE,Construction JSC No5,Industrials,Construction & Engineering,21850
SCC.HNO,SCC,UPCOM,SHB Trading Investment JSC,Materials,Construction Materials,4100
SCD.HM,SCD,HOSE,Chuong Duong Beverages JSC,Consumer Staples,Beverages,20200
SCI.HN,SCI,HNX,SCI E&C JSC,Industrials,Construction & Engineering,39900
SCL.HNO,SCL,UPCOM,Song Da Cao Cuong JSC,Materials,Construction Materials,2300
SCO.HNO,SCO,UPCOM,Seaproducts Mechanical Shareholding JSC,Industrials,Machinery,7200
SCR.HM,SCR,HOSE,Sai Gon Thuong Tin Real Estate JSC,Real Estate,Real Estate Management & Development,11150
SCS.HM,SCS,HOSE,Sai Gon Cargo Service Corp,Industrials,Air Freight & Logistics,142000
